
    =========================== USB Port2 ===========================

Connection Status        : 0x01 (Device is connected)
Port Chain               : 1-2-4-3-2

      ========================== Summary =========================
Vendor ID                : 0x0D28 (ARM Ltd)
Product ID               : 0x0204
USB Version              : 2.1
Port maximum Speed       : High-Speed
Device maximum Speed     : SuperSpeed
Device Connection Speed  : Full-Speed
Self powered             : no
Demanded Current         : 500 mA
Used Endpoints           : 8

      ======================== USB Device ========================

        +++++++++++++++++ Device Information ++++++++++++++++++
Device Description       : USB Composite Device
Device Path              : \\?\USB#VID_0D28&PID_0204#0604000048824e45005e7007dd89002f8761000097969900#{a5dcbf10-6530-11d2-901f-00c04fb951ed} (GUID_DEVINTERFACE_USB_DEVICE)
Kernel Name              : \Device\USBPDO-12
Device ID                : USB\VID_0D28&PID_0204\0604000048824E45005E7007DD89002F8761000097969900
Hardware IDs             : USB\VID_0D28&PID_0204&REV_1000 USB\VID_0D28&PID_0204
Driver KeyName           : {36fc9e60-c465-11cf-8056-444553540000}\0030 (GUID_DEVCLASS_USB)
Driver                   : \SystemRoot\System32\drivers\usbccgp.sys (Version: 10.0.19041.1806  Date: 2022-07-19)
Driver Inf               : C:\WINDOWS\inf\usb.inf
Legacy BusType           : PNPBus
Class                    : USB
Class GUID               : {36fc9e60-c465-11cf-8056-444553540000} (GUID_DEVCLASS_USB)
Service                  : usbccgp
Enumerator               : USB
Location Info            : Port_#0002.Hub_#0006
Location IDs             : PCIROOT(0)#PCI(1400)#USBROOT(0)#USB(2)#USB(4)#USB(3)#USB(2), ACPI(_SB_)#ACPI(PC00)#ACPI(XHCI)#ACPI(RHUB)#ACPI(HS02)#ACPI(EP04)#USB(3)#USB(2)
Container ID             : {518effc9-4367-577f-8b65-ed6b0e99ece5}
Manufacturer Info        : (Standard USB Host Controller)
Capabilities             : 0x94 (Removable, UniqueID, SurpriseRemovalOK)
Status                   : 0x0180600A (DN_DRIVER_LOADED, DN_STARTED, DN_DISABLEABLE, DN_REMOVABLE, DN_NT_ENUMERATOR, DN_NT_DRIVER)
Problem Code             : 0
Address                  : 2
HcDisableSelectiveSuspend: 0
EnableSelectiveSuspend   : 0
SelectiveSuspendEnabled  : 0
EnhancedPowerMgmtEnabled : 0
IdleInWorkingState       : 0
WakeFromSleepState       : 0
Power State              : D0 (supported: D0, D2, D3, wake from D0, wake from D2)
 Child Device 1          : USB Mass Storage Device
  Device ID              : USB\VID_0D28&PID_0204&MI_00\9&2D0DC0BC&0&0000
  Class                  : USB
  Driver KeyName         : {36fc9e60-c465-11cf-8056-444553540000}\0031 (GUID_DEVCLASS_USB)
  Service                : USBSTOR
  Location               : 0000.0014.0000.002.004.003.002.000.000
  LocationPaths          : PCIROOT(0)#PCI(1400)#USBROOT(0)#USB(2)#USB(4)#USB(3)#USB(2)#USBMI(0)  PCIROOT(0)#PCI(1400)#USBROOT(0)#USB(2)#USB(4)#USB(3)#USB(2)#USB(2)  ACPI(_SB_)#ACPI(PC00)#ACPI(XHCI)#ACPI(RHUB)#ACPI(HS02)#ACPI(EP04)#USB(3)#USB(2)#USBMI(0)  ACPI(_SB_)#ACPI(PC00)#ACPI(XHCI)#ACPI(RHUB)#ACPI(HS02)#ACPI(EP04)#USB(3)#USB(2)#USB(2)
   Child Device 1        : MBED VFS USB Device (Disk drive) (Disk3)
    Device Path          : \\?\USBSTOR#Disk&Ven_MBED&Prod_VFS&Rev_0.1#a&23051fdf&0&0604000048824e45005e7007dd89002f8761000097969900&0#{53f56307-b6bf-11d0-94f2-00a0c91efb8b} (GUID_DEVINTERFACE_DISK)
    Kernel Name          : \Device\0000009e
    Device ID            : USBSTOR\DISK&VEN_MBED&PROD_VFS&REV_0.1\A&23051FDF&0&0604000048824E45005E7007DD89002F8761000097969900&0
    Class                : DiskDrive
    Driver KeyName       : {4d36e967-e325-11ce-bfc1-08002be10318}\0010 (GUID_DEVCLASS_DISKDRIVE)
    Service              : disk
     Volume              : \\?\Volume{8e1f5ce0-0163-11ed-80cd-1051078f56b9}\
     Kernel Name         : \Device\HarddiskVolume11
     Mountpoint          : F:\
 Child Device 2          : USB 串行设备 (COM4) (USB Serial Device)
  Device Path            : \\?\USB#VID_0D28&PID_0204&MI_01#9&2d0dc0bc&0&0001#{86e0d1e0-8089-11d0-9ce4-08003e301f73} (GUID_DEVINTERFACE_COMPORT)
  Kernel Name            : \Device\0000009a
  Device ID              : USB\VID_0D28&PID_0204&MI_01\9&2D0DC0BC&0&0001
  Class                  : Ports
  Driver KeyName         : {4d36e978-e325-11ce-bfc1-08002be10318}\0001 (GUID_DEVCLASS_PORTS)
  Service                : usbser
  Location               : 0000.0014.0000.002.004.003.002.000.000
  LocationPaths          : PCIROOT(0)#PCI(1400)#USBROOT(0)#USB(2)#USB(4)#USB(3)#USB(2)#USBMI(1)  ACPI(_SB_)#ACPI(PC00)#ACPI(XHCI)#ACPI(RHUB)#ACPI(HS02)#ACPI(EP04)#USB(3)#USB(2)#USBMI(1)
  COM-Port               : COM4 (\Device\USBSER000)
 Child Device 3          : USB Input Device
  Device ID              : USB\VID_0D28&PID_0204&MI_03\9&2D0DC0BC&0&0003
  Class                  : HIDClass
  Driver KeyName         : {745a17a0-74d3-11d0-b6fe-00a0c90f57da}\0049 (GUID_DEVCLASS_HIDCLASS)
  Service                : HidUsb
  Location               : 0000.0014.0000.002.004.003.002.000.000
  LocationPaths          : PCIROOT(0)#PCI(1400)#USBROOT(0)#USB(2)#USB(4)#USB(3)#USB(2)#USBMI(3)  ACPI(_SB_)#ACPI(PC00)#ACPI(XHCI)#ACPI(RHUB)#ACPI(HS02)#ACPI(EP04)#USB(3)#USB(2)#USBMI(3)
   Child Device 1        : HID-compliant vendor-defined device
    Device Path          : \\?\HID#VID_0D28&PID_0204&MI_03#a&35da5cd4&0&0000#{4d1e55b2-f16f-11cf-88cb-001111000030} (GUID_DEVINTERFACE_HID)
    Kernel Name          : \Device\0000009f
    Device ID            : HID\VID_0D28&PID_0204&MI_03\A&35DA5CD4&0&0000
    Class                : HIDClass
    Driver KeyName       : {745a17a0-74d3-11d0-b6fe-00a0c90f57da}\0050 (GUID_DEVCLASS_HIDCLASS)
 Child Device 4          : WebUSB: CMSIS-DAP (WinUsb Device)
  Device Path 1          : \\?\USB#VID_0D28&PID_0204&MI_04#9&2d0dc0bc&0&0004#{dee824ef-729b-4a0e-9c14-b7117d33a817} (GUID_DEVINTERFACE_WINUSB)
  Device Path 2          : \\?\USB#VID_0D28&PID_0204&MI_04#9&2d0dc0bc&0&0004#{92ce6462-9c77-46fe-933b-31cb9c5aa3b9}
  Kernel Name            : \Device\0000009c
  Device ID              : USB\VID_0D28&PID_0204&MI_04\9&2D0DC0BC&0&0004
  Class                  : USBDevice
  Driver KeyName         : {88bae032-5a81-49f0-bc3d-a4ff138216d6}\0000 (GUID_DEVCLASS_USBDEVICE)
  Service                : WINUSB
  Location               : 0000.0014.0000.002.004.003.002.000.000
  LocationPaths          : PCIROOT(0)#PCI(1400)#USBROOT(0)#USB(2)#USB(4)#USB(3)#USB(2)#USBMI(4)  ACPI(_SB_)#ACPI(PC00)#ACPI(XHCI)#ACPI(RHUB)#ACPI(HS02)#ACPI(EP04)#USB(3)#USB(2)#USBMI(4)

        +++++++++++++++++ Registry USB Flags +++++++++++++++++
HKEY_LOCAL_MACHINE\SYSTEM\CurrentControlSet\Control\usbflags\0D2802041000
 NewInterfaceUsage       : REG_DWORD 00000000 (0)

        ---------------- Connection Information ---------------
Connection Index         : 0x02 (Port 2)
Connection Status        : 0x01 (DeviceConnected)
Current Config Value     : 0x01 (Configuration 1)
Device Address           : 0x0C (12)
Is Hub                   : 0x00 (no)
Device Bus Speed         : 0x01 (Full-Speed)
Number Of Open Pipes     : 0x07 (7 pipes to data endpoints)
Pipe[0]                  : EndpointID=3  Direction=IN   ScheduleOffset=0  Type=Interrupt  wMaxPacketSize=16    bInterval=32
Pipe[1]                  : EndpointID=1  Direction=IN   ScheduleOffset=0  Type=Interrupt  wMaxPacketSize=64    bInterval=1
Pipe[2]                  : EndpointID=1  Direction=OUT  ScheduleOffset=0  Type=Interrupt  wMaxPacketSize=64    bInterval=1
Pipe[3]                  : EndpointID=2  Direction=IN   ScheduleOffset=0  Type=Bulk       wMaxPacketSize=64    bInterval=0
Pipe[4]                  : EndpointID=2  Direction=OUT  ScheduleOffset=0  Type=Bulk       wMaxPacketSize=64    bInterval=0
Pipe[5]                  : EndpointID=4  Direction=OUT  ScheduleOffset=0  Type=Bulk       wMaxPacketSize=64    bInterval=0
Pipe[6]                  : EndpointID=4  Direction=IN   ScheduleOffset=0  Type=Bulk       wMaxPacketSize=64    bInterval=0
Data (HexDump)           : 02 00 00 00 12 01 10 02 EF 02 01 40 28 0D 04 02   ...........@(...
                           00 10 01 02 03 01 01 01 00 0C 00 07 00 00 00 01   ................
                           00 00 00 07 05 83 03 10 00 20 00 00 00 00 07 05   ......... ......
                           81 03 40 00 01 00 00 00 00 07 05 01 03 40 00 01   ..@..........@..
                           00 00 00 00 07 05 82 02 40 00 00 00 00 00 00 07   ........@.......
                           05 02 02 40 00 00 00 00 00 00 07 05 04 02 40 00   ...@..........@.
                           00 00 00 00 00 07 05 84 02 40 00 00 00 00 00 00   .........@......

        --------------- Connection Information V2 -------------
Connection Index         : 0x02 (2)
Length                   : 0x10 (16 bytes)
SupportedUsbProtocols    : 0x03
 Usb110                  : 1 (yes, port supports USB 1.1)
 Usb200                  : 1 (yes, port supports USB 2.0)
 Usb300                  : 0 (no, port not supports USB 3.0)
 ReservedMBZ             : 0x00
Flags                    : 0x00
 DevIsOpAtSsOrHigher     : 0 (Device is not operating at SuperSpeed or higher)
 DevIsSsCapOrHigher      : 0 (Device is not SuperSpeed capable or higher)
 DevIsOpAtSsPlusOrHigher : 0 (Device is not operating at SuperSpeedPlus or higher)
 DevIsSsPlusCapOrHigher  : 0 (Device is not SuperSpeedPlus capable or higher)
 ReservedMBZ             : 0x00
Data (HexDump)           : 02 00 00 00 10 00 00 00 03 00 00 00 00 00 00 00   ................

    ---------------------- Device Descriptor ----------------------
bLength                  : 0x12 (18 bytes)
bDescriptorType          : 0x01 (Device Descriptor)
bcdUSB                   : 0x210 (USB Version 2.1)
bDeviceClass             : 0xEF (Miscellaneous)
bDeviceSubClass          : 0x02
bDeviceProtocol          : 0x01 (IAD - Interface Association Descriptor)
bMaxPacketSize0          : 0x40 (64 bytes)
idVendor                 : 0x0D28 (ARM Ltd)
idProduct                : 0x0204
bcdDevice                : 0x1000
iManufacturer            : 0x01 (String Descriptor 1)
 Language 0x0409         : "ARM"
iProduct                 : 0x02 (String Descriptor 2)
 Language 0x0409         : "DAPLink CMSIS-DAP"
iSerialNumber            : 0x03 (String Descriptor 3)
 Language 0x0409         : "0604000048824e45005e7007dd89002f8761000097969900"
bNumConfigurations       : 0x01 (1 Configuration)
Data (HexDump)           : 12 01 10 02 EF 02 01 40 28 0D 04 02 00 10 01 02   .......@(.......
                           03 01                                             ..

    ------------------ Configuration Descriptor -------------------
bLength                  : 0x09 (9 bytes)
bDescriptorType          : 0x02 (Configuration Descriptor)
wTotalLength             : 0x008B (139 bytes)
bNumInterfaces           : 0x05 (5 Interfaces)
bConfigurationValue      : 0x01 (Configuration 1)
iConfiguration           : 0x00 (No String Descriptor)
bmAttributes             : 0x80
 D7: Reserved, set 1     : 0x01
 D6: Self Powered        : 0x00 (no)
 D5: Remote Wakeup       : 0x00 (no)
 D4..0: Reserved, set 0  : 0x00
MaxPower                 : 0xFA (500 mA)
Data (HexDump)           : 09 02 8B 00 05 01 00 80 FA 09 04 00 00 02 08 06   ................
                           50 08 07 05 82 02 40 00 00 07 05 02 02 40 00 00   P.....@......@..
                           08 0B 01 02 02 02 01 04 09 04 01 00 01 02 02 01   ................
                           04 05 24 00 10 01 05 24 01 03 02 04 24 02 06 05   ..$....$....$...
                           24 06 01 02 07 05 83 03 10 00 20 09 04 02 00 02   $......... .....
                           0A 00 00 05 07 05 04 02 40 00 00 07 05 84 02 40   ........@......@
                           00 00 09 04 03 00 02 03 00 00 06 09 21 00 01 00   ............!...
                           01 22 21 00 07 05 81 03 40 00 01 07 05 01 03 40   ."!.....@......@
                           00 01 09 04 04 00 00 FF 03 00 07                  ...........

        ---------------- Interface Descriptor -----------------
bLength                  : 0x09 (9 bytes)
bDescriptorType          : 0x04 (Interface Descriptor)
bInterfaceNumber         : 0x00 (Interface 0)
bAlternateSetting        : 0x00
bNumEndpoints            : 0x02 (2 Endpoints)
bInterfaceClass          : 0x08 (Mass Storage)
bInterfaceSubClass       : 0x06 (SCSI transparent command set)
bInterfaceProtocol       : 0x50 (Bulk-Only Transport)
iInterface               : 0x08 (String Descriptor 8)
 Language 0x0409         : "USB_MSC"
Data (HexDump)           : 09 04 00 00 02 08 06 50 08                        .......P.

        ----------------- Endpoint Descriptor -----------------
bLength                  : 0x07 (7 bytes)
bDescriptorType          : 0x05 (Endpoint Descriptor)
bEndpointAddress         : 0x82 (Direction=IN EndpointID=2)
bmAttributes             : 0x02 (TransferType=Bulk)
wMaxPacketSize           : 0x0040 (64 bytes)
bInterval                : 0x00 (ignored)
Data (HexDump)           : 07 05 82 02 40 00 00                              ....@..

        ----------------- Endpoint Descriptor -----------------
bLength                  : 0x07 (7 bytes)
bDescriptorType          : 0x05 (Endpoint Descriptor)
bEndpointAddress         : 0x02 (Direction=OUT EndpointID=2)
bmAttributes             : 0x02 (TransferType=Bulk)
wMaxPacketSize           : 0x0040 (64 bytes)
bInterval                : 0x00 (ignored)
Data (HexDump)           : 07 05 02 02 40 00 00                              ....@..

        ------------------- IAD Descriptor --------------------
bLength                  : 0x08 (8 bytes)
bDescriptorType          : 0x0B (Interface Association Descriptor)
bFirstInterface          : 0x01 (Interface 1)
bInterfaceCount          : 0x02 (2 Interfaces)
bFunctionClass           : 0x02 (Communications and CDC Control)
bFunctionSubClass        : 0x02
bFunctionProtocol        : 0x01
iFunction                : 0x04 (String Descriptor 4)
 Language 0x0409         : "mbed Serial Port"
Data (HexDump)           : 08 0B 01 02 02 02 01 04                           ........

        ---------------- Interface Descriptor -----------------
bLength                  : 0x09 (9 bytes)
bDescriptorType          : 0x04 (Interface Descriptor)
bInterfaceNumber         : 0x01 (Interface 1)
bAlternateSetting        : 0x00
bNumEndpoints            : 0x01 (1 Endpoint)
bInterfaceClass          : 0x02 (Communications and CDC Control)
bInterfaceSubClass       : 0x02 (Abstract Control Model)
bInterfaceProtocol       : 0x01 (AT Commands defined by ITU-T V.250 etc)
iInterface               : 0x04 (String Descriptor 4)
 Language 0x0409         : "mbed Serial Port"
Data (HexDump)           : 09 04 01 00 01 02 02 01 04                        .........

        -------------- CDC Interface Descriptor ---------------
bFunctionLength          : 0x05 (5 bytes)
bDescriptorType          : 0x24 (Interface)
bDescriptorSubType       : 0x00 (Header Functional Descriptor)
bcdCDC                   : 0x110 (CDC Version 1.10)
Data (HexDump)           : 05 24 00 10 01                                    .$...

        -------------- CDC Interface Descriptor ---------------
bFunctionLength          : 0x05 (5 bytes)
bDescriptorType          : 0x24 (Interface)
bDescriptorSubType       : 0x01 (Call Management Functional Descriptor)
bmCapabilities           : 0x03
 D7..2                   : 0x00 (Reserved)
 D1                      : 0x01 (can send/receive call management information over a Data Class interface)
 D0                      : 0x01 (handles call management itself)
bDataInterface           : 0x02
Data (HexDump)           : 05 24 01 03 02                                    .$...

        -------------- CDC Interface Descriptor ---------------
bFunctionLength          : 0x04 (4 bytes)
bDescriptorType          : 0x24 (Interface)
bDescriptorSubType       : 0x02 (Abstract Control Management Functional Descriptor)
bmCapabilities           : 0x06
 D7..4                   : 0x00 (Reserved)
 D3                      : 0x00 (not supports the notification Network_Connection)
 D2                      : 0x01 (supports the request Send_Break)
 D1                      : 0x01 (supports the request combination of Set_Line_Coding, Set_Control_Line_State, Get_Line_Coding, and the notification Serial_State)
 D0                      : 0x00 (not supports the request combination of Set_Comm_Feature, Clear_Comm_Feature, and Get_Comm_Feature)
Data (HexDump)           : 04 24 02 06                                       .$..

        -------------- CDC Interface Descriptor ---------------
bFunctionLength          : 0x05 (5 bytes)
bDescriptorType          : 0x24 (Interface)
bDescriptorSubType       : 0x06 (Union Functional Descriptor)
bControlInterface        : 0x01
bSubordinateInterface[0] : 0x02
Data (HexDump)           : 05 24 06 01 02                                    .$...

        ----------------- Endpoint Descriptor -----------------
bLength                  : 0x07 (7 bytes)
bDescriptorType          : 0x05 (Endpoint Descriptor)
bEndpointAddress         : 0x83 (Direction=IN EndpointID=3)
bmAttributes             : 0x03 (TransferType=Interrupt)
wMaxPacketSize           : 0x0010 (16 bytes)
bInterval                : 0x20 (32 ms)
Data (HexDump)           : 07 05 83 03 10 00 20                              ...... 

        ---------------- Interface Descriptor -----------------
bLength                  : 0x09 (9 bytes)
bDescriptorType          : 0x04 (Interface Descriptor)
bInterfaceNumber         : 0x02 (Interface 2)
bAlternateSetting        : 0x00
bNumEndpoints            : 0x02 (2 Endpoints)
bInterfaceClass          : 0x0A (CDC-Data)
bInterfaceSubClass       : 0x00
bInterfaceProtocol       : 0x00
iInterface               : 0x05 (String Descriptor 5)
 Language 0x0409         : "mbed Serial Port"
Data (HexDump)           : 09 04 02 00 02 0A 00 00 05                        .........

        ----------------- Endpoint Descriptor -----------------
bLength                  : 0x07 (7 bytes)
bDescriptorType          : 0x05 (Endpoint Descriptor)
bEndpointAddress         : 0x04 (Direction=OUT EndpointID=4)
bmAttributes             : 0x02 (TransferType=Bulk)
wMaxPacketSize           : 0x0040 (64 bytes)
bInterval                : 0x00 (ignored)
Data (HexDump)           : 07 05 04 02 40 00 00                              ....@..

        ----------------- Endpoint Descriptor -----------------
bLength                  : 0x07 (7 bytes)
bDescriptorType          : 0x05 (Endpoint Descriptor)
bEndpointAddress         : 0x84 (Direction=IN EndpointID=4)
bmAttributes             : 0x02 (TransferType=Bulk)
wMaxPacketSize           : 0x0040 (64 bytes)
bInterval                : 0x00 (ignored)
Data (HexDump)           : 07 05 84 02 40 00 00                              ....@..

        ---------------- Interface Descriptor -----------------
bLength                  : 0x09 (9 bytes)
bDescriptorType          : 0x04 (Interface Descriptor)
bInterfaceNumber         : 0x03 (Interface 3)
bAlternateSetting        : 0x00
bNumEndpoints            : 0x02 (2 Endpoints)
bInterfaceClass          : 0x03 (HID - Human Interface Device)
bInterfaceSubClass       : 0x00 (None)
bInterfaceProtocol       : 0x00 (None)
iInterface               : 0x06 (String Descriptor 6)
 Language 0x0409         : "CMSIS-DAP"
Data (HexDump)           : 09 04 03 00 02 03 00 00 06                        .........

        ------------------- HID Descriptor --------------------
bLength                  : 0x09 (9 bytes)
bDescriptorType          : 0x21 (HID Descriptor)
bcdHID                   : 0x0100 (HID Version 1.00)
bCountryCode             : 0x00 (00 = not localized)
bNumDescriptors          : 0x01
Data (HexDump)           : 09 21 00 01 00 01 22 21 00                        .!...."!.
Descriptor 1:
bDescriptorType          : 0x22 (Class=Report)
wDescriptorLength        : 0x0021 (33 bytes)
Error reading descriptor : ERROR_INVALID_PARAMETER (due to a obscure limitation of the Win32 USB API, see UsbTreeView.txt)

        ----------------- Endpoint Descriptor -----------------
bLength                  : 0x07 (7 bytes)
bDescriptorType          : 0x05 (Endpoint Descriptor)
bEndpointAddress         : 0x81 (Direction=IN EndpointID=1)
bmAttributes             : 0x03 (TransferType=Interrupt)
wMaxPacketSize           : 0x0040 (64 bytes)
bInterval                : 0x01 (1 ms)
Data (HexDump)           : 07 05 81 03 40 00 01                              ....@..

        ----------------- Endpoint Descriptor -----------------
bLength                  : 0x07 (7 bytes)
bDescriptorType          : 0x05 (Endpoint Descriptor)
bEndpointAddress         : 0x01 (Direction=OUT EndpointID=1)
bmAttributes             : 0x03 (TransferType=Interrupt)
wMaxPacketSize           : 0x0040 (64 bytes)
bInterval                : 0x01 (1 ms)
Data (HexDump)           : 07 05 01 03 40 00 01                              ....@..

        ---------------- Interface Descriptor -----------------
bLength                  : 0x09 (9 bytes)
bDescriptorType          : 0x04 (Interface Descriptor)
bInterfaceNumber         : 0x04 (Interface 4)
bAlternateSetting        : 0x00
bNumEndpoints            : 0x00 (Default Control Pipe only)
bInterfaceClass          : 0xFF (Vendor Specific)
bInterfaceSubClass       : 0x03
bInterfaceProtocol       : 0x00
iInterface               : 0x07 (String Descriptor 7)
 Language 0x0409         : "WebUSB: CMSIS-DAP"
Data (HexDump)           : 09 04 04 00 00 FF 03 00 07                        .........

    ----------------- Device Qualifier Descriptor -----------------
Error                    : ERROR_GEN_FAILURE

      ---------- Binary Object Store (BOS) Descriptor -----------
bLength                  : 0x05 (5 bytes)
bDescriptorType          : 0x0F (Binary Object Store)
wTotalLength             : 0x0039 (57 bytes)
bNumDeviceCaps           : 0x02
Data (HexDump)           : 05 0F 39 00 02                                    ..9..

        ----------- Platform Capabilities Descriptor -----------
bLength                  : 0x18 (24 bytes)
bDescriptorType          : 0x10 (Platform Capabilities)
bDevCapabilityType       : 0x05
bReserved                : 0x00
PlatformCapabilityUUID   : 3408B638-09A9-47A0-8BFD-A0768815B665
Data (HexDump)           : 18 10 05 00 38 B6 08 34 A9 09 A0 47 8B FD A0 76   ....8..4...G...v
                           88 15 B6 65 00 01 21 00                           ...e..!.

        ----------- Platform Capabilities Descriptor -----------
bLength                  : 0x1C (28 bytes)
bDescriptorType          : 0x10 (Platform Capabilities)
bDevCapabilityType       : 0x05
bReserved                : 0x00
PlatformCapabilityUUID   : D8DD60DF-4589-4CC7-9CD2-659D9E648A9F
Data (HexDump)           : 1C 10 05 00 DF 60 DD D8 89 45 C7 4C 9C D2 65 9D   .....`...E.L..e.
                           9E 64 8A 9F 00 00 03 06 AA 00 20 00               .d........ .

      -------------------- String Descriptors -------------------
             ------ String Descriptor 0 ------
bLength                  : 0x04 (4 bytes)
bDescriptorType          : 0x03 (String Descriptor)
Language ID[0]           : 0x0409 (English - United States)
Data (HexDump)           : 04 03 09 04                                       ....
             ------ String Descriptor 1 ------
bLength                  : 0x08 (8 bytes)
bDescriptorType          : 0x03 (String Descriptor)
Language 0x0409          : "ARM"
Data (HexDump)           : 08 03 41 00 52 00 4D 00                           ..A.R.M.
             ------ String Descriptor 2 ------
bLength                  : 0x24 (36 bytes)
bDescriptorType          : 0x03 (String Descriptor)
Language 0x0409          : "DAPLink CMSIS-DAP"
Data (HexDump)           : 24 03 44 00 41 00 50 00 4C 00 69 00 6E 00 6B 00   $.D.A.P.L.i.n.k.
                           20 00 43 00 4D 00 53 00 49 00 53 00 2D 00 44 00    .C.M.S.I.S.-.D.
                           41 00 50 00                                       A.P.
             ------ String Descriptor 3 ------
bLength                  : 0x62 (98 bytes)
bDescriptorType          : 0x03 (String Descriptor)
Language 0x0409          : "0604000048824e45005e7007dd89002f8761000097969900"
Data (HexDump)           : 62 03 30 00 36 00 30 00 34 00 30 00 30 00 30 00   b.0.6.0.4.0.0.0.
                           30 00 34 00 38 00 38 00 32 00 34 00 65 00 34 00   0.4.8.8.2.4.e.4.
                           35 00 30 00 30 00 35 00 65 00 37 00 30 00 30 00   5.0.0.5.e.7.0.0.
                           37 00 64 00 64 00 38 00 39 00 30 00 30 00 32 00   7.d.d.8.9.0.0.2.
                           66 00 38 00 37 00 36 00 31 00 30 00 30 00 30 00   f.8.7.6.1.0.0.0.
                           30 00 39 00 37 00 39 00 36 00 39 00 39 00 30 00   0.9.7.9.6.9.9.0.
                           30 00                                             0.
             ------ String Descriptor 4 ------
bLength                  : 0x22 (34 bytes)
bDescriptorType          : 0x03 (String Descriptor)
Language 0x0409          : "mbed Serial Port"
Data (HexDump)           : 22 03 6D 00 62 00 65 00 64 00 20 00 53 00 65 00   ".m.b.e.d. .S.e.
                           72 00 69 00 61 00 6C 00 20 00 50 00 6F 00 72 00   r.i.a.l. .P.o.r.
                           74 00                                             t.
             ------ String Descriptor 5 ------
bLength                  : 0x22 (34 bytes)
bDescriptorType          : 0x03 (String Descriptor)
Language 0x0409          : "mbed Serial Port"
Data (HexDump)           : 22 03 6D 00 62 00 65 00 64 00 20 00 53 00 65 00   ".m.b.e.d. .S.e.
                           72 00 69 00 61 00 6C 00 20 00 50 00 6F 00 72 00   r.i.a.l. .P.o.r.
                           74 00                                             t.
             ------ String Descriptor 6 ------
bLength                  : 0x14 (20 bytes)
bDescriptorType          : 0x03 (String Descriptor)
Language 0x0409          : "CMSIS-DAP"
Data (HexDump)           : 14 03 43 00 4D 00 53 00 49 00 53 00 2D 00 44 00   ..C.M.S.I.S.-.D.
                           41 00 50 00                                       A.P.
             ------ String Descriptor 7 ------
bLength                  : 0x24 (36 bytes)
bDescriptorType          : 0x03 (String Descriptor)
Language 0x0409          : "WebUSB: CMSIS-DAP"
Data (HexDump)           : 24 03 57 00 65 00 62 00 55 00 53 00 42 00 3A 00   $.W.e.b.U.S.B.:.
                           20 00 43 00 4D 00 53 00 49 00 53 00 2D 00 44 00    .C.M.S.I.S.-.D.
                           41 00 50 00                                       A.P.
             ------ String Descriptor 8 ------
bLength                  : 0x10 (16 bytes)
bDescriptorType          : 0x03 (String Descriptor)
Language 0x0409          : "USB_MSC"
Data (HexDump)           : 10 03 55 00 53 00 42 00 5F 00 4D 00 53 00 43 00   ..U.S.B._.M.S.C.
