
    =========================== USB Port7 ===========================

Connection Status        : 0x01 (Device is connected)
Port Chain               : 1-7
Properties               : 0x01
 IsUserConnectable       : yes
 PortIsDebugCapable      : no
 PortHasMultiCompanions  : no
 PortConnectorIsTypeC    : no
ConnectionIndex          : 0x07 (Port 7)
CompanionIndex           : 0
 CompanionHubSymLnk      : USB#ROOT_HUB30#4&11464b9&0&0#{f18a0e88-c30c-11d0-8815-00a0c906bed8}
 CompanionPortNumber     : 0x17 (Port 23)
 -> CompanionPortChain   : 1-23

      ========================== Summary =========================
Vendor ID                : 0x046D (Logitech Inc.)
Product ID               : 0xC53F
USB Version              : 2.0 -> but Device is Full-Speed only
Port maximum Speed       : High-Speed (Companion Port 1-23 supports SuperSpeed)
Device maximum Speed     : Full-Speed
Device Connection Speed  : Full-Speed
Self powered             : no
Demanded Current         : 98 mA
Used Endpoints           : 4

      ======================== USB Device ========================

        +++++++++++++++++ Device Information ++++++++++++++++++
Device Description       : USB Composite Device
Device Path              : \\?\USB#VID_046D&PID_C53F#5&2a6ec909&0&7#{a5dcbf10-6530-11d2-901f-00c04fb951ed} (GUID_DEVINTERFACE_USB_DEVICE)
Kernel Name              : \Device\USBPDO-4
Device ID                : USB\VID_046D&PID_C53F\5&2A6EC909&0&7
Hardware IDs             : USB\VID_046D&PID_C53F&REV_4401 USB\VID_046D&PID_C53F
Driver KeyName           : {36fc9e60-c465-11cf-8056-444553540000}\0004 (GUID_DEVCLASS_USB)
Driver                   : \SystemRoot\System32\drivers\usbccgp.sys (Version: 10.0.19041.1806  Date: 2022-07-19)
Driver Inf               : C:\WINDOWS\inf\usb.inf
Legacy BusType           : PNPBus
Class                    : USB
Class GUID               : {36fc9e60-c465-11cf-8056-444553540000} (GUID_DEVCLASS_USB)
Service                  : usbccgp
Enumerator               : USB
Location Info            : Port_#0007.Hub_#0001
Location IDs             : PCIROOT(0)#PCI(1400)#USBROOT(0)#USB(7), ACPI(_SB_)#ACPI(PC00)#ACPI(XHCI)#ACPI(RHUB)#ACPI(HS07)
Container ID             : {34e6d844-b72a-11ec-80ac-806e6f6e6963}
Manufacturer Info        : (Standard USB Host Controller)
Capabilities             : 0x84 (Removable, SurpriseRemovalOK)
Status                   : 0x0180400A (DN_DRIVER_LOADED, DN_STARTED, DN_REMOVABLE, DN_NT_ENUMERATOR, DN_NT_DRIVER)
Problem Code             : 0
Address                  : 7
HcDisableSelectiveSuspend: 0
EnableSelectiveSuspend   : 0
SelectiveSuspendEnabled  : 0
EnhancedPowerMgmtEnabled : 0
IdleInWorkingState       : 0
WakeFromSleepState       : 0
Power State              : D0 (supported: D0, D1, D2, D3, wake from D0, wake from D1, wake from D2)
 Child Device 1          : USB Input Device
  Device ID              : USB\VID_046D&PID_C53F&MI_00\6&316B6B3B&0&0000
  Class                  : HIDClass
  Driver KeyName         : {745a17a0-74d3-11d0-b6fe-00a0c90f57da}\0000 (GUID_DEVCLASS_HIDCLASS)
  Service                : HidUsb
  Location               : 0000.0014.0000.007.000.000.000.000.000
  LocationPaths          : PCIROOT(0)#PCI(1400)#USBROOT(0)#USB(7)#USBMI(0)  PCIROOT(0)#PCI(1400)#USBROOT(0)#USB(7)#USB(7)  ACPI(_SB_)#ACPI(PC00)#ACPI(XHCI)#ACPI(RHUB)#ACPI(HS07)#USBMI(0)  ACPI(_SB_)#ACPI(PC00)#ACPI(XHCI)#ACPI(RHUB)#ACPI(HS07)#USB(7)
   Child Device 1        : HID Keyboard Device
    Device Path 1        : \\?\HID#VID_046D&PID_C53F&MI_00#7&3802f7a&0&0000#{4d1e55b2-f16f-11cf-88cb-001111000030}\kbd (GUID_DEVINTERFACE_HID)
    Device Path 2        : \\?\HID#VID_046D&PID_C53F&MI_00#7&3802f7a&0&0000#{884b96c3-56ef-11d1-bc8c-00a0c91405dd} (GUID_DEVINTERFACE_KEYBOARD)
    Kernel Name          : \Device\00000056
    Device ID            : HID\VID_046D&PID_C53F&MI_00\7&3802F7A&0&0000
    Class                : Keyboard
    Driver KeyName       : {4d36e96b-e325-11ce-bfc1-08002be10318}\0000 (GUID_DEVCLASS_KEYBOARD)
    Service              : kbdhid
 Child Device 2          : USB Input Device
  Device ID              : USB\VID_046D&PID_C53F&MI_01\6&316B6B3B&0&0001
  Class                  : HIDClass
  Driver KeyName         : {745a17a0-74d3-11d0-b6fe-00a0c90f57da}\0001 (GUID_DEVCLASS_HIDCLASS)
  Service                : HidUsb
  Location               : 0000.0014.0000.007.000.000.000.000.000
  LocationPaths          : PCIROOT(0)#PCI(1400)#USBROOT(0)#USB(7)#USBMI(1)  ACPI(_SB_)#ACPI(PC00)#ACPI(XHCI)#ACPI(RHUB)#ACPI(HS07)#USBMI(1)
   Child Device 1        : HID-compliant mouse
    Device Path 1        : \\?\HID#VID_046D&PID_C53F&MI_01&Col01#7&27576d3c&0&0000#{378de44c-56ef-11d1-bc8c-00a0c91405dd} (GUID_DEVINTERFACE_MOUSE)
    Device Path 2        : \\?\HID#VID_046D&PID_C53F&MI_01&Col01#7&27576d3c&0&0000#{4d1e55b2-f16f-11cf-88cb-001111000030} (GUID_DEVINTERFACE_HID)
    Kernel Name          : \Device\00000057
    Device ID            : HID\VID_046D&PID_C53F&MI_01&COL01\7&27576D3C&0&0000
    Class                : Mouse
    Driver KeyName       : {4d36e96f-e325-11ce-bfc1-08002be10318}\0000 (GUID_DEVCLASS_MOUSE)
    Service              : mouhid
   Child Device 2        : HID-compliant consumer control device
    Device Path          : \\?\HID#VID_046D&PID_C53F&MI_01&Col02#7&27576d3c&0&0001#{4d1e55b2-f16f-11cf-88cb-001111000030} (GUID_DEVINTERFACE_HID)
    Kernel Name          : \Device\00000058
    Device ID            : HID\VID_046D&PID_C53F&MI_01&COL02\7&27576D3C&0&0001
    Class                : HIDClass
    Driver KeyName       : {745a17a0-74d3-11d0-b6fe-00a0c90f57da}\0004 (GUID_DEVCLASS_HIDCLASS)
   Child Device 3        : HID-compliant system controller
    Device Path 1        : \\?\HID#VID_046D&PID_C53F&MI_01&Col03#7&27576d3c&0&0002#{4afa3d53-74a7-11d0-be5e-00a0c9062857} (GUID_DEVICE_SYS_BUTTON)
    Device Path 2        : \\?\HID#VID_046D&PID_C53F&MI_01&Col03#7&27576d3c&0&0002#{4d1e55b2-f16f-11cf-88cb-001111000030} (GUID_DEVINTERFACE_HID)
    Kernel Name          : \Device\00000059
    Device ID            : HID\VID_046D&PID_C53F&MI_01&COL03\7&27576D3C&0&0002
    Class                : HIDClass
    Driver KeyName       : {745a17a0-74d3-11d0-b6fe-00a0c90f57da}\0005 (GUID_DEVCLASS_HIDCLASS)
   Child Device 4        : HID-compliant vendor-defined device
    Device Path          : \\?\HID#VID_046D&PID_C53F&MI_01&Col04#7&27576d3c&0&0003#{4d1e55b2-f16f-11cf-88cb-001111000030} (GUID_DEVINTERFACE_HID)
    Kernel Name          : \Device\0000005a
    Device ID            : HID\VID_046D&PID_C53F&MI_01&COL04\7&27576D3C&0&0003
    Class                : HIDClass
    Driver KeyName       : {745a17a0-74d3-11d0-b6fe-00a0c90f57da}\0006 (GUID_DEVCLASS_HIDCLASS)
 Child Device 3          : USB Input Device
  Device ID              : USB\VID_046D&PID_C53F&MI_02\6&316B6B3B&0&0002
  Class                  : HIDClass
  Driver KeyName         : {745a17a0-74d3-11d0-b6fe-00a0c90f57da}\0002 (GUID_DEVCLASS_HIDCLASS)
  Service                : HidUsb
  Location               : 0000.0014.0000.007.000.000.000.000.000
  LocationPaths          : PCIROOT(0)#PCI(1400)#USBROOT(0)#USB(7)#USBMI(2)  ACPI(_SB_)#ACPI(PC00)#ACPI(XHCI)#ACPI(RHUB)#ACPI(HS07)#USBMI(2)
   Child Device 1        : HID-compliant vendor-defined device
    Device Path          : \\?\HID#VID_046D&PID_C53F&MI_02&Col01#7&200f6ed&0&0000#{4d1e55b2-f16f-11cf-88cb-001111000030} (GUID_DEVINTERFACE_HID)
    Kernel Name          : \Device\0000005b
    Device ID            : HID\VID_046D&PID_C53F&MI_02&COL01\7&200F6ED&0&0000
    Class                : HIDClass
    Driver KeyName       : {745a17a0-74d3-11d0-b6fe-00a0c90f57da}\0007 (GUID_DEVCLASS_HIDCLASS)
   Child Device 2        : HID-compliant vendor-defined device
    Device Path          : \\?\HID#VID_046D&PID_C53F&MI_02&Col02#7&200f6ed&0&0001#{4d1e55b2-f16f-11cf-88cb-001111000030} (GUID_DEVINTERFACE_HID)
    Kernel Name          : \Device\0000005c
    Device ID            : HID\VID_046D&PID_C53F&MI_02&COL02\7&200F6ED&0&0001
    Class                : HIDClass
    Driver KeyName       : {745a17a0-74d3-11d0-b6fe-00a0c90f57da}\0008 (GUID_DEVCLASS_HIDCLASS)
   Child Device 3        : HID-compliant vendor-defined device
    Device Path          : \\?\HID#VID_046D&PID_C53F&MI_02&Col03#7&200f6ed&0&0002#{4d1e55b2-f16f-11cf-88cb-001111000030} (GUID_DEVINTERFACE_HID)
    Kernel Name          : \Device\0000005d
    Device ID            : HID\VID_046D&PID_C53F&MI_02&COL03\7&200F6ED&0&0002
    Class                : HIDClass
    Driver KeyName       : {745a17a0-74d3-11d0-b6fe-00a0c90f57da}\0009 (GUID_DEVCLASS_HIDCLASS)

        +++++++++++++++++ Registry USB Flags +++++++++++++++++
HKEY_LOCAL_MACHINE\SYSTEM\CurrentControlSet\Control\usbflags\046DC53F4401
 osvc                    : REG_BINARY 00 00
 NewInterfaceUsage       : REG_DWORD 00000000 (0)

        ---------------- Connection Information ---------------
Connection Index         : 0x07 (Port 7)
Connection Status        : 0x01 (DeviceConnected)
Current Config Value     : 0x01 (Configuration 1)
Device Address           : 0x01 (1)
Is Hub                   : 0x00 (no)
Device Bus Speed         : 0x01 (Full-Speed)
Number Of Open Pipes     : 0x03 (3 pipes to data endpoints)
Pipe[0]                  : EndpointID=1  Direction=IN   ScheduleOffset=0  Type=Interrupt  wMaxPacketSize=12    bInterval=1
Pipe[1]                  : EndpointID=2  Direction=IN   ScheduleOffset=0  Type=Interrupt  wMaxPacketSize=32    bInterval=1
Pipe[2]                  : EndpointID=3  Direction=IN   ScheduleOffset=0  Type=Interrupt  wMaxPacketSize=32    bInterval=1
Data (HexDump)           : 07 00 00 00 12 01 00 02 00 00 00 20 6D 04 3F C5   ........... m.?.
                           01 44 01 02 00 01 01 01 00 01 00 03 00 00 00 01   .D..............
                           00 00 00 07 05 81 03 0C 00 01 00 00 00 00 07 05   ................
                           82 03 20 00 01 00 00 00 00 07 05 83 03 20 00 01   .. .......... ..
                           00 00 00 00                                       ....

        --------------- Connection Information V2 -------------
Connection Index         : 0x07 (7)
Length                   : 0x10 (16 bytes)
SupportedUsbProtocols    : 0x03
 Usb110                  : 1 (yes, port supports USB 1.1)
 Usb200                  : 1 (yes, port supports USB 2.0)
 Usb300                  : 0 (no, port not supports USB 3.0) -> but Companion Port 1-23 does
 ReservedMBZ             : 0x00
Flags                    : 0x00
 DevIsOpAtSsOrHigher     : 0 (Device is not operating at SuperSpeed or higher)
 DevIsSsCapOrHigher      : 0 (Device is not SuperSpeed capable or higher)
 DevIsOpAtSsPlusOrHigher : 0 (Device is not operating at SuperSpeedPlus or higher)
 DevIsSsPlusCapOrHigher  : 0 (Device is not SuperSpeedPlus capable or higher)
 ReservedMBZ             : 0x00
Data (HexDump)           : 07 00 00 00 10 00 00 00 03 00 00 00 00 00 00 00   ................

    ---------------------- Device Descriptor ----------------------
bLength                  : 0x12 (18 bytes)
bDescriptorType          : 0x01 (Device Descriptor)
bcdUSB                   : 0x200 (USB Version 2.0) -> but device is Full-Speed only
bDeviceClass             : 0x00 (defined by the interface descriptors)
bDeviceSubClass          : 0x00
bDeviceProtocol          : 0x00
bMaxPacketSize0          : 0x20 (32 bytes)
idVendor                 : 0x046D (Logitech Inc.)
idProduct                : 0xC53F
bcdDevice                : 0x4401
iManufacturer            : 0x01 (String Descriptor 1)
 Language 0x0409         : "Logitech"
iProduct                 : 0x02 (String Descriptor 2)
 Language 0x0409         : "USB Receiver"
iSerialNumber            : 0x00 (No String Descriptor)
bNumConfigurations       : 0x01 (1 Configuration)
Data (HexDump)           : 12 01 00 02 00 00 00 20 6D 04 3F C5 01 44 01 02   ....... m.?..D..
                           00 01                                             ..

    ------------------ Configuration Descriptor -------------------
bLength                  : 0x09 (9 bytes)
bDescriptorType          : 0x02 (Configuration Descriptor)
wTotalLength             : 0x0054 (84 bytes)
bNumInterfaces           : 0x03 (3 Interfaces)
bConfigurationValue      : 0x01 (Configuration 1)
iConfiguration           : 0x04 (String Descriptor 4)
 Language 0x0409         : "RQR44.01_B0005"
bmAttributes             : 0xA0
 D7: Reserved, set 1     : 0x01
 D6: Self Powered        : 0x00 (no)
 D5: Remote Wakeup       : 0x01 (yes)
 D4..0: Reserved, set 0  : 0x00
MaxPower                 : 0x31 (98 mA)
Data (HexDump)           : 09 02 54 00 03 01 04 A0 31 09 04 00 00 01 03 01   ..T.....1.......
                           01 00 09 21 11 01 00 01 22 3B 00 07 05 81 03 0C   ...!....";......
                           00 01 09 04 01 00 01 03 01 02 00 09 21 11 01 00   ............!...
                           01 22 94 00 07 05 82 03 20 00 01 09 04 02 00 01   ."...... .......
                           03 00 00 00 09 21 11 01 00 01 22 62 00 07 05 83   .....!...."b....
                           03 20 00 01                                       . ..

        ---------------- Interface Descriptor -----------------
bLength                  : 0x09 (9 bytes)
bDescriptorType          : 0x04 (Interface Descriptor)
bInterfaceNumber         : 0x00 (Interface 0)
bAlternateSetting        : 0x00
bNumEndpoints            : 0x01 (1 Endpoint)
bInterfaceClass          : 0x03 (HID - Human Interface Device)
bInterfaceSubClass       : 0x01 (Boot Interface)
bInterfaceProtocol       : 0x01 (Keyboard)
iInterface               : 0x00 (No String Descriptor)
Data (HexDump)           : 09 04 00 00 01 03 01 01 00                        .........

        ------------------- HID Descriptor --------------------
bLength                  : 0x09 (9 bytes)
bDescriptorType          : 0x21 (HID Descriptor)
bcdHID                   : 0x0111 (HID Version 1.11)
bCountryCode             : 0x00 (00 = not localized)
bNumDescriptors          : 0x01
Data (HexDump)           : 09 21 11 01 00 01 22 3B 00                        .!....";.
Descriptor 1:
bDescriptorType          : 0x22 (Class=Report)
wDescriptorLength        : 0x003B (59 bytes)
Error reading descriptor : ERROR_INVALID_PARAMETER (due to a obscure limitation of the Win32 USB API, see UsbTreeView.txt)

        ----------------- Endpoint Descriptor -----------------
bLength                  : 0x07 (7 bytes)
bDescriptorType          : 0x05 (Endpoint Descriptor)
bEndpointAddress         : 0x81 (Direction=IN EndpointID=1)
bmAttributes             : 0x03 (TransferType=Interrupt)
wMaxPacketSize           : 0x000C (12 bytes)
bInterval                : 0x01 (1 ms)
Data (HexDump)           : 07 05 81 03 0C 00 01                              .......

        ---------------- Interface Descriptor -----------------
bLength                  : 0x09 (9 bytes)
bDescriptorType          : 0x04 (Interface Descriptor)
bInterfaceNumber         : 0x01 (Interface 1)
bAlternateSetting        : 0x00
bNumEndpoints            : 0x01 (1 Endpoint)
bInterfaceClass          : 0x03 (HID - Human Interface Device)
bInterfaceSubClass       : 0x01 (Boot Interface)
bInterfaceProtocol       : 0x02 (Mouse)
iInterface               : 0x00 (No String Descriptor)
Data (HexDump)           : 09 04 01 00 01 03 01 02 00                        .........

        ------------------- HID Descriptor --------------------
bLength                  : 0x09 (9 bytes)
bDescriptorType          : 0x21 (HID Descriptor)
bcdHID                   : 0x0111 (HID Version 1.11)
bCountryCode             : 0x00 (00 = not localized)
bNumDescriptors          : 0x01
Data (HexDump)           : 09 21 11 01 00 01 22 94 00                        .!...."..
Descriptor 1:
bDescriptorType          : 0x22 (Class=Report)
wDescriptorLength        : 0x0094 (148 bytes)
Error reading descriptor : ERROR_INVALID_PARAMETER (due to a obscure limitation of the Win32 USB API, see UsbTreeView.txt)

        ----------------- Endpoint Descriptor -----------------
bLength                  : 0x07 (7 bytes)
bDescriptorType          : 0x05 (Endpoint Descriptor)
bEndpointAddress         : 0x82 (Direction=IN EndpointID=2)
bmAttributes             : 0x03 (TransferType=Interrupt)
wMaxPacketSize           : 0x0020 (32 bytes)
bInterval                : 0x01 (1 ms)
Data (HexDump)           : 07 05 82 03 20 00 01                              .... ..

        ---------------- Interface Descriptor -----------------
bLength                  : 0x09 (9 bytes)
bDescriptorType          : 0x04 (Interface Descriptor)
bInterfaceNumber         : 0x02 (Interface 2)
bAlternateSetting        : 0x00
bNumEndpoints            : 0x01 (1 Endpoint)
bInterfaceClass          : 0x03 (HID - Human Interface Device)
bInterfaceSubClass       : 0x00 (None)
bInterfaceProtocol       : 0x00 (None)
iInterface               : 0x00 (No String Descriptor)
Data (HexDump)           : 09 04 02 00 01 03 00 00 00                        .........

        ------------------- HID Descriptor --------------------
bLength                  : 0x09 (9 bytes)
bDescriptorType          : 0x21 (HID Descriptor)
bcdHID                   : 0x0111 (HID Version 1.11)
bCountryCode             : 0x00 (00 = not localized)
bNumDescriptors          : 0x01
Data (HexDump)           : 09 21 11 01 00 01 22 62 00                        .!...."b.
Descriptor 1:
bDescriptorType          : 0x22 (Class=Report)
wDescriptorLength        : 0x0062 (98 bytes)
Error reading descriptor : ERROR_INVALID_PARAMETER (due to a obscure limitation of the Win32 USB API, see UsbTreeView.txt)

        ----------------- Endpoint Descriptor -----------------
bLength                  : 0x07 (7 bytes)
bDescriptorType          : 0x05 (Endpoint Descriptor)
bEndpointAddress         : 0x83 (Direction=IN EndpointID=3)
bmAttributes             : 0x03 (TransferType=Interrupt)
wMaxPacketSize           : 0x0020 (32 bytes)
bInterval                : 0x01 (1 ms)
Data (HexDump)           : 07 05 83 03 20 00 01                              .... ..

    ----------------- Device Qualifier Descriptor -----------------
Error                    : ERROR_GEN_FAILURE  (because the device is Full-Speed only)

      -------------------- String Descriptors -------------------
             ------ String Descriptor 0 ------
bLength                  : 0x04 (4 bytes)
bDescriptorType          : 0x03 (String Descriptor)
Language ID[0]           : 0x0409 (English - United States)
Data (HexDump)           : 04 03 09 04                                       ....
             ------ String Descriptor 1 ------
bLength                  : 0x12 (18 bytes)
bDescriptorType          : 0x03 (String Descriptor)
Language 0x0409          : "Logitech"
Data (HexDump)           : 12 03 4C 00 6F 00 67 00 69 00 74 00 65 00 63 00   ..L.o.g.i.t.e.c.
                           68 00                                             h.
             ------ String Descriptor 2 ------
bLength                  : 0x1A (26 bytes)
bDescriptorType          : 0x03 (String Descriptor)
Language 0x0409          : "USB Receiver"
Data (HexDump)           : 1A 03 55 00 53 00 42 00 20 00 52 00 65 00 63 00   ..U.S.B. .R.e.c.
                           65 00 69 00 76 00 65 00 72 00                     e.i.v.e.r.
             ------ String Descriptor 4 ------
bLength                  : 0x1E (30 bytes)
bDescriptorType          : 0x03 (String Descriptor)
Language 0x0409          : "RQR44.01_B0005"
Data (HexDump)           : 1E 03 52 00 51 00 52 00 34 00 34 00 2E 00 30 00   ..R.Q.R.4.4...0.
                           31 00 5F 00 42 00 30 00 30 00 30 00 35 00         1._.B.0.0.0.5.
