
    =========================== USB Port1 ===========================

Connection Status        : 0x01 (Device is connected)
Port Chain               : 1-2-4-4-1

      ========================== Summary =========================
Vendor ID                : 0x0483 (STMicroelectronics)
Product ID               : 0x572B
USB Version              : 2.0 -> but Device is Full-Speed only
Port maximum Speed       : High-Speed
Device maximum Speed     : Full-Speed
Device Connection Speed  : Full-Speed
Self powered             : yes
Demanded Current         : 100 mA
Used Endpoints           : 2

      ======================== USB Device ========================

        +++++++++++++++++ Device Information ++++++++++++++++++
Device Description       : USB Input Device
Device Path              : \\?\USB#VID_0483&PID_572B#395538753439#{a5dcbf10-6530-11d2-901f-00c04fb951ed} (GUID_DEVINTERFACE_USB_DEVICE)
Kernel Name              : \Device\USBPDO-11
Device ID                : USB\VID_0483&PID_572B\395538753439
Hardware IDs             : USB\VID_0483&PID_572B&REV_0200 USB\VID_0483&PID_572B
Driver KeyName           : {745a17a0-74d3-11d0-b6fe-00a0c90f57da}\0051 (GUID_DEVCLASS_HIDCLASS)
Driver                   : \SystemRoot\System32\drivers\hidusb.sys (Version: 10.0.19041.868  Date: 2022-04-08)
Driver Inf               : C:\WINDOWS\inf\input.inf
Legacy BusType           : PNPBus
Class                    : HIDClass
Class GUID               : {745a17a0-74d3-11d0-b6fe-00a0c90f57da} (GUID_DEVCLASS_HIDCLASS)
Service                  : HidUsb
Enumerator               : USB
Location Info            : Port_#0001.Hub_#0006
Location IDs             : PCIROOT(0)#PCI(1400)#USBROOT(0)#USB(2)#USB(4)#USB(4)#USB(1), ACPI(_SB_)#ACPI(PC00)#ACPI(XHCI)#ACPI(RHUB)#ACPI(HS02)#ACPI(EP04)#USB(4)#USB(1)
Container ID             : {8e1f5cd1-0163-11ed-80cd-1051078f56b9}
Manufacturer Info        : (Standard system devices)
Capabilities             : 0x90 (UniqueID, SurpriseRemovalOK)
Status                   : 0x0180200A (DN_DRIVER_LOADED, DN_STARTED, DN_DISABLEABLE, DN_NT_ENUMERATOR, DN_NT_DRIVER)
Problem Code             : 0
HcDisableSelectiveSuspend: 0
EnableSelectiveSuspend   : 0
SelectiveSuspendEnabled  : 0
EnhancedPowerMgmtEnabled : 1
IdleInWorkingState       : 0
WakeFromSleepState       : 0
Power State              : D0 (supported: D0, D1, D2, D3, wake from D0, wake from D1, wake from D2)
 Child Device 1          : HID-compliant mouse
  Device Path 1          : \\?\HID#VID_0483&PID_572B#9&2a76549&0&0000#{4d1e55b2-f16f-11cf-88cb-001111000030} (GUID_DEVINTERFACE_HID)
  Device Path 2          : \\?\HID#VID_0483&PID_572B#9&2a76549&0&0000#{378de44c-56ef-11d1-bc8c-00a0c91405dd} (GUID_DEVINTERFACE_MOUSE)
  Kernel Name            : \Device\000000ac
  Device ID              : HID\VID_0483&PID_572B\9&2A76549&0&0000
  Class                  : Mouse
  Driver KeyName         : {4d36e96f-e325-11ce-bfc1-08002be10318}\0009 (GUID_DEVCLASS_MOUSE)
  Service                : mouhid

        +++++++++++++++++ Registry USB Flags +++++++++++++++++
HKEY_LOCAL_MACHINE\SYSTEM\CurrentControlSet\Control\usbflags\0483572B0200
 osvc                    : REG_BINARY 00 00

        ---------------- Connection Information ---------------
Connection Index         : 0x01 (Port 1)
Connection Status        : 0x01 (DeviceConnected)
Current Config Value     : 0x01 (Configuration 1)
Device Address           : 0x27 (39)
Is Hub                   : 0x00 (no)
Device Bus Speed         : 0x01 (Full-Speed)
Number Of Open Pipes     : 0x01 (1 pipe to data endpoints)
Pipe[0]                  : EndpointID=1  Direction=IN   ScheduleOffset=0  Type=Interrupt  wMaxPacketSize=4     bInterval=10
Data (HexDump)           : 01 00 00 00 12 01 00 02 00 00 00 40 83 04 2B 57   ...........@..+W
                           00 02 01 02 03 01 01 01 00 27 00 01 00 00 00 01   .........'......
                           00 00 00 07 05 81 03 04 00 0A 00 00 00 00         ..............

        --------------- Connection Information V2 -------------
Connection Index         : 0x01 (1)
Length                   : 0x10 (16 bytes)
SupportedUsbProtocols    : 0x03
 Usb110                  : 1 (yes, port supports USB 1.1)
 Usb200                  : 1 (yes, port supports USB 2.0)
 Usb300                  : 0 (no, port not supports USB 3.0)
 ReservedMBZ             : 0x00
Flags                    : 0x00
 DevIsOpAtSsOrHigher     : 0 (Device is not operating at SuperSpeed or higher)
 DevIsSsCapOrHigher      : 0 (Device is not SuperSpeed capable or higher)
 DevIsOpAtSsPlusOrHigher : 0 (Device is not operating at SuperSpeedPlus or higher)
 DevIsSsPlusCapOrHigher  : 0 (Device is not SuperSpeedPlus capable or higher)
 ReservedMBZ             : 0x00
Data (HexDump)           : 01 00 00 00 10 00 00 00 03 00 00 00 00 00 00 00   ................

    ---------------------- Device Descriptor ----------------------
bLength                  : 0x12 (18 bytes)
bDescriptorType          : 0x01 (Device Descriptor)
bcdUSB                   : 0x200 (USB Version 2.0) -> but device is Full-Speed only
bDeviceClass             : 0x00 (defined by the interface descriptors)
bDeviceSubClass          : 0x00
bDeviceProtocol          : 0x00
bMaxPacketSize0          : 0x40 (64 bytes)
idVendor                 : 0x0483 (STMicroelectronics)
idProduct                : 0x572B
bcdDevice                : 0x0200
iManufacturer            : 0x01 (String Descriptor 1)
 Language 0x0409         : "STMicroelectronics"
iProduct                 : 0x02 (String Descriptor 2)
 Language 0x0409         : "STM32 Human interface"
iSerialNumber            : 0x03 (String Descriptor 3)
 Language 0x0409         : "395538753439"
bNumConfigurations       : 0x01 (1 Configuration)
Data (HexDump)           : 12 01 00 02 00 00 00 40 83 04 2B 57 00 02 01 02   .......@..+W....
                           03 01                                             ..

    ------------------ Configuration Descriptor -------------------
bLength                  : 0x09 (9 bytes)
bDescriptorType          : 0x02 (Configuration Descriptor)
wTotalLength             : 0x0022 (34 bytes)
bNumInterfaces           : 0x01 (1 Interface)
bConfigurationValue      : 0x01 (Configuration 1)
iConfiguration           : 0x00 (No String Descriptor)
bmAttributes             : 0xE0
 D7: Reserved, set 1     : 0x01
 D6: Self Powered        : 0x01 (yes)
 D5: Remote Wakeup       : 0x01 (yes)
 D4..0: Reserved, set 0  : 0x00
MaxPower                 : 0x32 (100 mA)
Data (HexDump)           : 09 02 22 00 01 01 00 E0 32 09 04 00 00 01 03 01   ..".....2.......
                           02 00 09 21 11 01 00 01 22 4A 00 07 05 81 03 04   ...!...."J......
                           00 0A                                             ..

        ---------------- Interface Descriptor -----------------
bLength                  : 0x09 (9 bytes)
bDescriptorType          : 0x04 (Interface Descriptor)
bInterfaceNumber         : 0x00 (Interface 0)
bAlternateSetting        : 0x00
bNumEndpoints            : 0x01 (1 Endpoint)
bInterfaceClass          : 0x03 (HID - Human Interface Device)
bInterfaceSubClass       : 0x01 (Boot Interface)
bInterfaceProtocol       : 0x02 (Mouse)
iInterface               : 0x00 (No String Descriptor)
Data (HexDump)           : 09 04 00 00 01 03 01 02 00                        .........

        ------------------- HID Descriptor --------------------
bLength                  : 0x09 (9 bytes)
bDescriptorType          : 0x21 (HID Descriptor)
bcdHID                   : 0x0111 (HID Version 1.11)
bCountryCode             : 0x00 (00 = not localized)
bNumDescriptors          : 0x01
Data (HexDump)           : 09 21 11 01 00 01 22 4A 00                        .!...."J.
Descriptor 1:
bDescriptorType          : 0x22 (Class=Report)
wDescriptorLength        : 0x004A (74 bytes)
Error reading descriptor : ERROR_INVALID_PARAMETER (due to a obscure limitation of the Win32 USB API, see UsbTreeView.txt)

        ----------------- Endpoint Descriptor -----------------
bLength                  : 0x07 (7 bytes)
bDescriptorType          : 0x05 (Endpoint Descriptor)
bEndpointAddress         : 0x81 (Direction=IN EndpointID=1)
bmAttributes             : 0x03 (TransferType=Interrupt)
wMaxPacketSize           : 0x0004 (4 bytes)
bInterval                : 0x0A (10 ms)
Data (HexDump)           : 07 05 81 03 04 00 0A                              .......

    ----------------- Device Qualifier Descriptor -----------------
Error                    : ERROR_GEN_FAILURE  (because the device is Full-Speed only)

      -------------------- String Descriptors -------------------
             ------ String Descriptor 0 ------
bLength                  : 0x04 (4 bytes)
bDescriptorType          : 0x03 (String Descriptor)
Language ID[0]           : 0x0409 (English - United States)
Data (HexDump)           : 04 03 09 04                                       ....
             ------ String Descriptor 1 ------
bLength                  : 0x26 (38 bytes)
bDescriptorType          : 0x03 (String Descriptor)
Language 0x0409          : "STMicroelectronics"
Data (HexDump)           : 26 03 53 00 54 00 4D 00 69 00 63 00 72 00 6F 00   &.S.T.M.i.c.r.o.
                           65 00 6C 00 65 00 63 00 74 00 72 00 6F 00 6E 00   e.l.e.c.t.r.o.n.
                           69 00 63 00 73 00                                 i.c.s.
             ------ String Descriptor 2 ------
bLength                  : 0x2C (44 bytes)
bDescriptorType          : 0x03 (String Descriptor)
Language 0x0409          : "STM32 Human interface"
Data (HexDump)           : 2C 03 53 00 54 00 4D 00 33 00 32 00 20 00 48 00   ,.S.T.M.3.2. .H.
                           75 00 6D 00 61 00 6E 00 20 00 69 00 6E 00 74 00   u.m.a.n. .i.n.t.
                           65 00 72 00 66 00 61 00 63 00 65 00               e.r.f.a.c.e.
             ------ String Descriptor 3 ------
bLength                  : 0x1A (26 bytes)
bDescriptorType          : 0x03 (String Descriptor)
Language 0x0409          : "395538753439"
Data (HexDump)           : 1A 03 33 00 39 00 35 00 35 00 33 00 38 00 37 00   ..3.9.5.5.3.8.7.
                           35 00 33 00 34 00 33 00 39 00                     5.3.4.3.9.
             ------ String Descriptor 4 ------
bLength                  : 0x16 (22 bytes)
bDescriptorType          : 0x03 (String Descriptor)
Language 0x0409          : "HID Config"
Data (HexDump)           : 16 03 48 00 49 00 44 00 20 00 43 00 6F 00 6E 00   ..H.I.D. .C.o.n.
                           66 00 69 00 67 00                                 f.i.g.
             ------ String Descriptor 5 ------
bLength                  : 0x1C (28 bytes)
bDescriptorType          : 0x03 (String Descriptor)
Language 0x0409          : "HID Interface"
Data (HexDump)           : 1C 03 48 00 49 00 44 00 20 00 49 00 6E 00 74 00   ..H.I.D. .I.n.t.
                           65 00 72 00 66 00 61 00 63 00 65 00               e.r.f.a.c.e.


Temporary breakpoint 5, main () at Src/main.c:75
75	  HAL_Init();

Breakpoint 1, USBD_HS_LangIDStrDescriptor (speed=USBD_SPEED_FULL, length=0x2004ff5e) at Src/usbd_desc.c:277
277	  *length = sizeof(USBD_LangIDDesc); 4,3,9,4

Breakpoint 3, USBD_HS_ProductStrDescriptor (speed=USBD_SPEED_FULL, length=0x2004ff5e) at Src/usbd_desc.c:295
295	    USBD_GetString((uint8_t *)USBD_PRODUCT_STRING_HS, USBD_StrDesc, length); 44, 3, STM32...

Breakpoint 1, USBD_HS_LangIDStrDescriptor (speed=USBD_SPEED_FULL, length=0x2004ff5e) at Src/usbd_desc.c:277
277	  *length = sizeof(USBD_LangIDDesc);

Breakpoint 4, USBD_HS_ManufacturerStrDescriptor (speed=USBD_SPEED_FULL, length=0x2004ff5e) at Src/usbd_desc.c:309
309	  USBD_GetString((uint8_t *)USBD_MANUFACTURER_STRING, USBD_StrDesc, length);

Breakpoint 1, USBD_HS_LangIDStrDescriptor (speed=USBD_SPEED_FULL, length=0x2004ff5e) at Src/usbd_desc.c:277
277	  *length = sizeof(USBD_LangIDDesc);

Breakpoint 3, USBD_HS_ProductStrDescriptor (speed=USBD_SPEED_FULL, length=0x2004ff5e) at Src/usbd_desc.c:295
295	    USBD_GetString((uint8_t *)USBD_PRODUCT_STRING_HS, USBD_StrDesc, length);

Breakpoint 1, USBD_HS_LangIDStrDescriptor (speed=USBD_SPEED_FULL, length=0x2004ff5e) at Src/usbd_desc.c:277
277	  *length = sizeof(USBD_LangIDDesc);

Breakpoint 1, USBD_HS_LangIDStrDescriptor (speed=USBD_SPEED_FULL, length=0x2004ff5e) at Src/usbd_desc.c:277
277	  *length = sizeof(USBD_LangIDDesc);

Breakpoint 4, USBD_HS_ManufacturerStrDescriptor (speed=USBD_SPEED_FULL, length=0x2004ff5e) at Src/usbd_desc.c:309
309	  USBD_GetString((uint8_t *)USBD_MANUFACTURER_STRING, USBD_StrDesc, length);

Breakpoint 3, USBD_HS_ProductStrDescriptor (speed=USBD_SPEED_FULL, length=0x2004ff5e) at Src/usbd_desc.c:295
295	    USBD_GetString((uint8_t *)USBD_PRODUCT_STRING_HS, USBD_StrDesc, length);